Chinese Words,pinyin,English Words,Question Type,Category,Chinese Usage in a Sentence,English Usage in a sentence,Color,Chinese Usage in a Sentence Hint,Band 0 HSK
爱好,àihào,Hobby,Both,Misc,我的爱好是画画和看书,My hobbies are painting and reading.,5,我的__是画画和看书,Band1
包子,bāozi,Bun,Both,Food/Drinks,我早饭吃了两个包子,I ate two steamed buns for breakfast,5,我早饭吃了两个__,Band1
打车,dǎchē,take a taxi,Both,Vehicle,太晚了，我们打车回家吧,"It’s too late, let’s take a taxi home",5,太晚了，我们__回家吧,Band1
地点,dìdiǎn,location,Both,Location,会议将在市中心的一个新地点举行,The meeting will take place at a new location downtown.,5,会议将在市中心的一个新__举行,Band1
地方,dìfang,Local as in Local officials,English,Misc,地方当局正在调查这起事件,The local authorities are investigating the incident,5,__当局正在调查这起事件,Band1
电影院,diànyǐngyuàn,Cinema,English,Location,我们晚上去电影院看电影吧,Let’s go to the cinema tonight,5,我们晚上去__看电影吧,Band1
地图,dìtú,Map,Both,Misc,我用地图找到了那家饭店,I used a map to find that restaurant,5,我用__找到了那家饭店,Band1
汉字,hànzì,Chinese character,English,Misc,我每天练习写汉字,I practice writing Chinese characters every day,5,我每天练习写__,Band1
行,háng,noun (háng): profession / line of work,Both,Misc,他在技术这一行很有经验，说他行是有道理的。,"He has lots of experience in the tech field, so saying he’s good at it makes sense.",5,他在技术这一__很有经验，说他__是有道理的。,Band1
机票,jīpiào,plane ticket,English,Misc,你的机票买了吗,Did you buy your plane ticket?,5,你的__买了吗,Band1
家人,jiārén,family,English,Misc,我很想念我的家人,I really miss my family.,5,我很想念我的__,Band1
见面,jiànmiàn,meet,Both,Misc,我们下周见面吧,Let’s meet next week.,5,我们下周__吧,Band1
开车,kāichē,drive,Both,Vehicle,我不会开车,I don’t know how to drive,5,我不会__,Band1
课文,kèwén,main body of text within a lesson in a textbook or educational material,Both,School,请大声朗读这篇课文,Please read the text aloud.,5,请大声朗读这篇__,Band1
路口,lùkǒu,intersection,Both,Location,到下一个路口右转,Turn right at the next intersection.,5,到下一个__右转,Band1
门票,ménpiào,tickets,English,Misc,博物馆的门票多少钱？,How much is the museum ticket?,5,博物馆的__多少钱？,Band1
请假,qǐngjià,ask for leave,English,Misc,我明天要请假,I need to take a day off tomorrow.,5,我明天要__,Band1
网友,wǎngyǒu,net friend,Chinese,Misc,我有很多网友,I have lots of online friends.,5,我有很多__,Band1
正在,zhèngzài,in process of,Chinese,Misc,我正在吃饭,I’m eating (right now).,5,我__吃饭,Band1
重要,zhòngyào,important,English,Misc,家人对我来说最重要,Family is the most important to me.,5,家人对我来说最__,Band1
商场,shāngchǎng,noun: shopping mall / department store,Both,Misc,这家商场今天打折，人特别多。,This shopping mall is having a sale today — it's super crowded.,5,这家__今天打折，人特别多。,Band1
商店,shāngdiàn,noun: shop / store,Both,Misc,那家商店24小时营业，晚上也可以买东西。,"That store is open 24 hours, so you can shop even at night.",5,那家__24小时营业，晚上也可以买东西。,Band1
介绍,jièshào,"verb: to introduce

noun: introduction",Both,Misc,老师先做了自我介绍，然后介绍了今天的课程安排。,"The teacher first introduced herself, then introduced the day’s lesson plan.",5,老师先做了自我__，然后__了今天的课程安排。,Band1
上网,shàngwǎng,verb: to go online / surf the internet,Both,Misc,我每天晚上都会上网查资料。,I go online every night to look things up.,5,我每天晚上都会__查资料。,Band1
天气,tiānqì,noun: weather,Both,Misc,今天天气很好，适合去散步。,The weather is great today — perfect for a walk.,5,今天__很好，适合去散步。,Band1
外语,wàiyǔ,noun: foreign language,Both,Misc,她从小就对外语很感兴趣，现在能说三种语言。,She’s been interested in foreign languages since young and can now speak three.,5,她从小就对__很感兴趣，现在能说三种语言。,Band1
外国,wàiguó,noun: foreign country,Both,Misc,他明年打算去外国留学。,He plans to study abroad next year.,5,他明年打算去__留学。,Band1
网友,wǎngyǒu,noun: online friend,Both,Misc,我和一个网友聊了很久，后来还见了面,"I chatted with an online friend for a long time, and we eventually met in person.",5,我和一个__聊了很久，后来还见了面,Band1
学院,xuéyuàn,noun: college / institute,Both,Misc,她就读于艺术学院，主修绘画。,"She studies at an art college, majoring in painting.",5,她就读于艺术__，主修绘画。,Band1
页,yè,"noun: page (in a book, document, website)",Both,Misc,"请翻到书的第五十页。
",Please turn to page 50 of the book.,5,"""请翻到书的第五十__。
""",Band1
工人,gōngrén,Worker,English,Misc,我的叔叔是一名工人,My uncle is a worker,5,我的叔叔是一名__,Band1
机场,jīchǎng,Airport,English,Location,我们明天早上去机场接他,We’re going to the airport tomorrow morning to pick him up,5,我们明天早上去__接他,Band1
教学楼,jiàoxuélóu,teaching building,English,School,我们的教室在第二教学楼,Our classroom is in the second academic building,5,我们的教室在第二__,Band1
哪些,nǎxiē,which,Both,Misc,你喜欢哪些电影？,Which movies do you like?,5,你喜欢__电影？,Band1
上班,shàngbān,go to work,Chinese,Misc,我早上九点上班,I start work at 9 a.m.,5,我早上九点__,Band1
爱人,àirén,lover,Both,Misc,她的爱人很支持她的工作,Her partner/lover really supports her work,5,她的__很支持她的工作,Band2
爱情,àiqíng,"romance/ romantic love — the kind of love between lovers, partners, or spouses",Both,Misc,爱情征服一切，我们必须屈从爱情。,There is deep romantic love between them,5,他们之间有很深的__,Band2
半夜,bànyè,in the middle of the night,Both,Time,不要半夜打电话给我,Don’t call me in the middle of the night.,5,不要__打电话给我,Band2
报名,bàomíng,sign up,Both,Misc,你报名参加比赛了吗？,Did you sign up for the competition?,5,你报名参加比赛了吗？,Band2
遍,biàn,Times,Both,Misc,这本书我读了三遍,I’ve read this book three times (completely).,5,这本书我读了三__,Band2
变成,biànchéng,become; change into,English,Misc,水变成了冰,Water turned into ice.,5,水__了冰,Band2
表示,biǎoshì,To Express,Both,Misc,他表示了他的担忧,He expressed his concern,5,他__了他的担忧,Band2
笔记本,bǐjìběn,Notebook,Both,School,我买了一个新笔记本来记汉字,I bought a new notebook to write down Chinese characters.,5,我买了一个新__来记汉字,Band2
比如,bǐrú,such as,English,Misc,我喜欢很多运动，比如篮球和游泳,"I like many sports, for example, basketball and swimming.",5,我喜欢很多运动，__篮球和游泳,Band2
必须,bǐxú,Must,Both,Misc,你必须每天练习中文。,You must practice Chinese every day.,5,你__每天练习中文。,Band2
不但,búdàn,not only,English,Misc,他不但聪明，而且非常勤奋,"He is not only intelligent, but also very hardworking",5,他__聪明，__非常勤奋,Band2
不满,bùmǎn,dissatisfied,Chinese,Misc,"(Adjective)员工们对新的政策感到不满
(Noun)这引起了许多人的不满",He is very dissatisfied with the service,5,"(Adjective)员工们对新的政策感到__
(Noun)这引起了许多人的__",Band2
不太,bútài,not too; not very much,Both,Misc,这个价格不太贵,This price is not too expensive.,5,这个价格__贵,Band2
不同,bùtóng,different,Chinese,Misc,我们有不同的看法,We have different opinions.,5,我们有__的看法,Band2
不一定,bùyīdìng,not necessarily; uncertain,English,Misc,贵的不一定就是最好的,Expensive doesn’t necessarily mean the best.,5,贵的__就是最好的,Band2
部分,bùfen,Part,Both,Misc,我只看了这本书的一部分,I only read part of this book.,5,我只看了这本书的一__,Band2
不过,búguò,However,Both,Misc,我很想去旅行，不过最近太忙了,"I really want to travel, however, I've been too busy lately",5,我很想去旅行，__最近太忙了,Band2
不如,bùrú,not as good as,Chinese,Misc,这个手机不如那个好,This phone isn’t as good as that one,5,这个手机__那个好,Band2
菜单,càidān,menu,English,Food/Drinks,菜单上有很多素菜,There are lots of vegetarian dishes on the menu.,5,__上有很多素菜,Band2
参观,cānguān,visit,English,Misc,我们明天要去参观博物馆,We’re going to visit the museum tomorrow.,5,我们明天要去__博物馆,Band2
草地,cǎodì,lawn,English,Location,孩子们在草地上玩游戏,The kids are playing on the grass.,5,孩子们在 __上玩游戏,Band2
常见,chángjiàn,common,Both,Misc,这是一个很常见的问题,This is a very common problem.,5,这是一个很__的问题,Band2
常用,chángyòng,commonly used,English,Misc,这些是常用的汉字,These are commonly used Chinese characters.,5,这些是__的汉字,Band2
超过,chāoguò,Exceed,English,Misc,他的身高超过了一米八,Our income has exceeded last year’s.,5,他的身高__了一米八,Band2
超市,chāoshì,Supermarket,English,Location,我去超市买点儿东西,I'm going to the supermarket to buy something.,5,我去__买点儿东西,Band2
成绩,chéngjì,results,English,Misc,她的考试成绩非常好,Her exam results are excellent.,5,她的考试__非常好,Band2
重复,chóngfù,repeat,Chinese,Misc,别总是重复同样的错误,Don’t keep repeating the same mistakes.,5,别总是__同样的错误,Band2
重新,chóngxīn,repeat again from the start,English,Misc,你可以重新开始,You can start over.,5,你可以__开始,Band2
出口,chūkǒu,export,English,Misc,这些产品出口到欧洲,These products are exported to Europe.,5,这些产品__到欧洲,Band2
出院,chūyuàn,discharged; leave hospital,Both,Misc,他昨天刚出院,He was just discharged from the hospital yesterday.,5,他昨天刚__,Band2
出租,chūzū,rent,Both,Misc,这套房子正在出租,This apartment is currently for rent.,5,这套房子正在__,Band2
出生,chūshēng,born,English,Misc,他是2000年出生的。,He was born in the year 2000.,5,他是2000年__的。,Band2
出租车,chūzūchē,taxi,Chinese,Vehicle,我需要叫一辆出租车,I need to call a taxi.,5,我需要叫一辆__,Band2
大部分,dàbùfèn,most,English,Misc,大部分学生都通过了考试,Most of the students passed the exam.,5,__学生都通过了考试,Band2
大多数,dàduōshù,most people; great majority of people,Both,Misc,大多数人喜欢这个电影。,The majority of people like this movie.,5,__人喜欢这个电影。,Band2
大量,dàliàng,a lot of,Both,Misc,他喝了大量的水,He drank a large amount of water.,5,他喝了__的水,Band2
大小,dàxiǎo,size,Both,Misc,这些箱子的大小都不一样,These boxes are all different sizes.,5,这些箱子的__都不一样,Band2
大衣,dàyī,overcoat,Both,Clothes,今天太冷了，我穿了大衣,It’s too cold today—I wore a coat.,5,今天太冷了，我穿了__,Band2
大自然,dàzìrán,nature,Both,Misc,我们应该保护大自然,We should protect nature.,5,我们应该保护__,Band2
打工,dǎgōng,to work a part-time or casual job,Both,Misc,很多大学生暑假去打工,Many college students work part-time during summer break.,5,很多大学生暑假去__,Band2
当时,dāngshí,at that time,Both,Misc,我当时不知道该怎么办,"At that time, I didn’t know what to do.",5,我__不知道该怎么办,Band2
单位,dānwèi,"Can still refer to a person's workplace, especially in more formal or official contexts, or when the organization has some level of state affiliation.
Can also be used more generally to mean a ""unit"" within an organization or system.",Chinese,Misc,我在一个政府单位工作,I work at a government organization.,5,我在一个政府__工作,Band2
道路,dào,"Scope: It tends to refer to main roads, highways, or a system of roads. It can also be used metaphorically to mean a path or way (e.g., a path to success).
Formality: It's more common in formal writing, official announcements, news reports, and technical contexts.",Chinese,Location,城市的道路越来越多了,There are more and more roads in the city.,5,城市的__越来越多了,Band2
到处,dàochù,everywhere,Both,Misc,节日的时候，城市里到处都是人,"During holidays, the city is full of people everywhere.",5,节日的时候，城市里__都是人,Band2
道理,dàolǐ,reason / principle / logic,Both,Misc,"你说的很有道理
他从来不听道理。","What you said makes a lot of sense.
He never listens to reason.",5,"你说的很有__
他从来不听__。",Band2
打算,dǎsuàn,Plan,Both,Misc,我打算下个月去旅行。,I plan to travel next month.,5,我__下个月去旅行。,Band2
打印,dǎyìn,Print,Both,Misc,我需要打印这份文件,I need to print this document.,5,我需要__这份文件,Band2
答应,dāying,promise,English,Misc,你答应过我的！,You promised me!,5,你__过我的！,Band2
得出,déchū,to come to (a conclusion,Both,Misc,我们得出了一个结论,We came to a conclusion.,5,我们__了一个结论,Band2
等于,děngyú,Be equal to,Both,Math,二加二等于四,Two plus two equals four.,5,二加二__四,Band2
读音,dúyīn,pronunciation,Both,Misc,这个汉字有两个读音,This character has two pronunciations.,5,这个汉字有两个__,Band2
段,duàn,paragraph,English,Misc,请读一下这段文章,Please read this paragraph,5,请读一下这__文章,Band2
短信,duǎnxìn,text message,Both,Misc,我给你发了一个短信,I sent you a text message.,5,我给你发了一个__,Band2
队,duì,team,Both,Misc,他们是一支足球队,They are a soccer team.,5,他们是一支足球__,Band2
队长,duìzhǎng,team leader; captain,English,Misc,队长负责安排训练,The captain is in charge of organizing training.,5,__负责安排训练,Band2
对话,duìhuà,dialogue,Both,Misc,这是一段很有趣的对话,This is a very interesting dialogue.,5,这是一段很有趣的__,Band2
对面,duìmiàn,Opposite side,Both,Misc,银行就在学校对面,The bank is right across from the school.,5,银行就在学校__,Band2
多数,duōshù,most; majority,Both,Misc,多数人都同意这个计划,The majority of people agree with this plan.,5,__人都同意这个计划,Band2
饭馆,fànguǎn,restaurant,English,Location,这家饭馆的菜很好吃,The food at this restaurant is really tasty.,5,这家__的菜很好吃,Band2
方便,fāngbiàn,convenient,English,Misc,你什么时候方便见面？,When is it convenient for you to meet?,5,你什么时候__见面？,Band2
方面,fāngmiàn,Aspect,Both,Misc,我们要在各个方面改进工作,We need to improve our work in every aspect.,5,我们要在各个__改进工作,Band2
方向,fāngxiàng,direction,Both,Misc,请问火车站的方向是哪边？,"Excuse me, which way is the train station?",5,请问火车站的__是哪边？,Band2
放心,fàngxīn,Don't worry,English,Misc,你放心，我会帮你的,"Don’t worry, I’ll help you.",5,你__，我会帮你的,Band2
分数,fēnshù,score; mark; fraction,Both,Misc,他的分数比我高。,His score is higher than mine.,5,他的__比我高。,Band2
服务,fúwù,service,Both,Misc,这家饭店的服务很好,我们的工作是为客户服务,5,这家饭店的__很好,Band2
改变,gǎibiàn,change,Chinese Sentence,Misc,你不想改变一下自己吗？,Don’t you want to change yourself a bit?,5,你不想__一下自己吗？,Band2
感谢,gǎnxiè,Thank,Chinese Sentence,Misc,我想借这个机会表示感谢。,I want to take this opportunity to express my thanks.,5,我想借这个机会表示__。,Band2
高级,gāojí,advanced / high-level,Both,Misc,他上的是高级汉语课。,He’s taking an advanced Chinese class.,5,他上的是__汉语课。,Band2
个子,gèzi,Height,Both,Misc,你弟弟个子真高！,Your little brother is really tall!,5,你弟弟__真高！,Band2
公交车,gōngjiāochē,public transport vehicle,Chinese,Misc,在中国，很多人选择乘坐公交车出行,"In China, many people choose to travel by public bus",5,在中国，很多人选择乘坐__出行,Band2
公路,gōnglù,generally refers to a major road connecting cities and towns. (Not the same as expressway),Both,Misc,我们沿着这条公路一直开。,We drove straight along this highway.,5,我们沿着这条__一直开。,Band2
公共汽车,gōnggòngqìchē,public vehicle (formal version),Chinese,Misc,这条路线的公共汽车班次不多,The public bus services on this route are infrequent,5,这条路线的__班次不多,Band2
公斤,gōngjīn,kilogram,English,Misc,这个西瓜有五公斤重,This watermelon weighs five kilograms.,5,这个西瓜有五__重,Band2
公里,gōnglǐ,kilometre,Both,Misc,学校离我家有三公里远。,The school is three kilometers away from my home.,5,学校离我家有三__远。,Band2
公平,gōngpíng,fair,Both,Misc,老师对每个学生都很公平。,The teacher is fair to every student.,5,老师对每个学生都很__。,Band2
公司,gōngsī,company,English,Misc,他在一家外国公司工作。,He works at a foreign company.,5,他在一家外国__工作。,Band2
关机,guānjī,"to turn off (a machine/device),"" ""to shut down,"" or ""to power off.""",Both,Misc,请把这个设备关机,Please turn off this device,5,请把这个设备__,Band2
观点,guāndiǎn,"viewpoint / point of view (more formal version, often used in writing, debates, essays, or academic discussions.)",Both,Misc,我同意你的观点。,I agree with your point of view.,5,我同意你的__。,Band2
广场,guǎngchǎng,square (not the shape),Both,Misc,孩子们在广场上玩游戏。,The children are playing games in the square.,5,孩子们在__上玩游戏。,Band2
广告,guǎnggào,Advertisement,English,Misc,电视上正在播放一则新的广告。,A new advertisement is playing on TV.,5,电视上正在播放一则新的__。,Band2
顾客,gùkè,customer,Both,Misc,顾客永远是第一位的。,The customer is always the top priority.,5,__永远是第一位的。,Band2
过去,guòqù,"noun: the past
verb: to go over / to pass by",Both,Misc,过去的事情就让它过去吧,Let the past stay in the past.,5,__的事情就让它过去吧,Band2
国际,guójì,international,Both,Misc,他在一家国际学校上学。,He studies at an international school.,5,他在一家__学校上学。,Band2
故意,gùyì,deliberately,Both,Misc,他不是故意打破杯子的。,He didn’t break the cup on purpose.,5,他不是__打破杯子的。,Band2
好事,hǎoshì,good deed; good thing,Chinese,Misc,他们结婚了，真是件好事！,They got married—what a wonderful thing!,5,他们结婚了，真是件__！,Band2
好处,hǎochu,benefit,English,Misc,多运动对身体有好处。,Exercising more is beneficial for your health.,5,多运动对身体有__。,Band2
合适,héshì,appropriate,Both,Misc,这件衣服对你来说很合适。,This piece of clothing suits you well.,5,这件衣服对你来说很__。,Band2
湖,hú,lake,Both,Location,湖边的风景非常美丽。,The scenery by the lake is very beautiful.,5,__边的风景非常美丽。,Band2
画家,huàjiā,painter,English,Misc,他是一位著名的画家。,He is a famous painter.,5,他是一位著名的__。,Band2
坏处,huàichù,disadvantage; harm,English,Misc,抽烟对身体有坏处。,Smoking is harmful to your health.,5,抽烟对身体有__。,Band2
忽然,hūrán,suddenly,Chinese Sentence,Misc,天气忽然变冷了。,The weather suddenly turned cold.,5,天气__变冷了。,Band2
护照,hùzhào,passport,Both,Misc,出国旅行需要护照。,You need a passport to travel abroad.,5,出国旅行需要__。,Band2
急,jí,urgent;,English,Misc,别急，我们还有时间。,"Don’t worry, we still have time.",5,别__，我们还有时间。,Band2
家长,jiāzhǎng,parent,Both,Misc,学校邀请家长来开会。,The school invited the parents to a meeting.,5,学校邀请__来开会。,Band2
角,jiǎo,Animal horn,English,Misc,许多动物都有角，用来防御或在争斗中使用,"Xǔduō dòngwù dōu yǒu jiǎo, yòng lái fángyù huò zài zhēngdòu zhōng shǐyòng.",5,许多动物都有__，用来防御或在争斗中使用,Band2
交朋友,jiāopéngyǒu,make friends,Both,Misc,他很容易交朋友。,He makes friends easily.,5,他很容易__。,Band2
教师,jiàoshī,teacher,Chinese,School,他是一位有经验的中文教师。,He is an experienced Chinese teacher.,5,他是一位有经验的中文__。,Band2
教育,jiàoyù,education,Both,Misc,新加坡的教育体系非常注重双语能力,Singapore's education system places great emphasis on bilingualism,5,新加坡的__体系非常注重双语能力,Band2
叫作,jiàozuò,"be called; be known as (used in more informal situations, names, and common terms.)",Both,Misc,这种游戏叫作“狼人杀”。,"This kind of game is called ""Werewolf"".",5,这种游戏__“狼人杀”。,Band2
角度,jiǎodù,"angle, perspective, point of view",Both,Misc,从不同的角度看问题很重要。,It’s important to look at problems from different angles.,5,从不同的__看问题很重要。,Band2
教室,jiàoshì,class room (China version),Both,School,教室里很安静，大家都在学习。,It’s quiet in the classroom; everyone is studying.,5,教室里很__，大家都在学习。,Band2
交通,jiāotōng,"Transportation, traffic. It encompasses the movement of people and goods from one place to another, as well as the systems and infrastructure that support this movement.",Both,Misc,"这个城市的交通非常方便。
上班高峰期的交通非常拥堵",The transportation in this city is very convenient. The traffic during rush hour is very congested,5,"这个城市的__非常方便。
上班高峰期的__非常拥堵",Band2
教学,jiàoxué,"teaching as a profession, a process, or a system",Both,Misc,"他的教学方法很有效
这所大学非常重视教学质量",His teaching methods are very effective. We are discussing the new teaching syllabus (or curriculum),5,"他的__方法很有效
这所大学非常重视__质量",Band2
接,jiē,"act of connecting, meeting, or taking",Both,Misc,我去车站接朋友,I’m going to the station to pick up a friend.,5,我去车站__朋友,Band2
街,jiē,street,Both,Misc,这条街上有很多商店。,There are many shops on this street.,5,这条__上有很多商店。,Band2
接到,jiēdào,successful completion of receiving something that was sent or communicated,Both,Misc,我刚接到一个电话。,I just received a phone call.,5,我刚__一个电话。,Band2
接下来,jiēxiàlái,"""next"" in a sequence of events, actions, or topics",Both,Misc,接下来我们要讨论市场营销策略,"Next, we will discuss the marketing strategy.",5,__我们要讨论市场营销策略,Band2
结果,jiéguǒ,Result,Both,Misc,比赛的结果很令人满意。,The result of the match was very satisfying.,5,比赛的__很令人满意。,Band2
节目,jiémù,program,Both,Misc,我最喜欢那个歌唱节目。,My favorite is that singing program.,5,我最喜欢那个歌唱__。,Band2
节日,jiérì,festival,Both,Misc,春节是中国最重要的节日。,Spring Festival is the most important holiday in China.,5,春节是中国最重要的__。,Band2
接受,jiēshòu,"to accept (an idea, suggestion, gift, etc.)",Both,Misc,他很快接受了这个事实。,He accepted the fact quickly.,5,他很快__了这个事实。,Band2
接着,jiēzhe,Next/then based on the sentence context,Both,Misc,他吃完饭，接着去散步。,"He finished eating, then went for a walk.",5,他吃完饭，__去散步。,Band2
计划,jìhuà,plan,Both,Misc,我们下周有一个旅游计划。,We have a travel plan for next week.,5,我们下周有一个旅游 __。,Band2
近,jìn,near,English,Misc,学校离我家很近,The school is very close to my home.,5,学校离我家很__,Band2
斤,jīn,a unit of weight (=1/2 kilogram),Both,Misc,我要买两斤苹果。,I want to buy two jin of apples. (approx. 1 kg),5,我要买两__苹果。,Band2
今后,jīnhòu,from now on; in the future,Both,Misc,今后我要每天学习中文。,"From now on, I will study Chinese every day.",5,__我要每天学习中文。,Band2
经过,jīngguò,to pass by / to go through,Both,Misc,我每天上学都会经过那家咖啡店。,I pass by that coffee shop every day on my way to school.,5,我每天上学都会__那家咖啡店。,Band2
经理,jīnglǐ,manager,Both,Misc,他是这家餐厅的经理。,He is the manager of this restaurant.,5,他是这家餐厅的__。,Band2
进行,jìnxíng,to carry out / to proceed,Both,Misc,比赛正在进行中。,The competition is in progress.,5,比赛正在__中。,Band2
举,jǔ,to raise / to lift,Both,Misc,请举手回答问题。,Please raise your hand to answer the question.,5,请__手回答问题。,Band2
举行,jǔxíng,to hold (an event),Both,Misc,学校下周将举行运动会。,The school will hold a sports day next week.,5,学校下周将__运动会。,Band2
句子,jùzi,sentence,Both,Misc,请用这个词造一个句子。,Please make a sentence with this word.,5,请用这个词造一个__。,Band2
开机,kāijī,to turn on (a machine/device),Both,Misc,请先开机，然后登录系统,"Please turn on the device first, then log in to the system.",5,请先__，然后登录系统,Band2
